{
  "$schema": "./scripts/RepoFlow/repo-flow.schema.json",
  "defaultRepository": "example-app",
  "repositories": [
    {
      "name": "example-app",
      "localPath": "C:\\Projects\\RepoFlow\\example-app",
      "slug": "owner/example-app",
      "expectedOrigins": [
        "https://github.com/owner/example-app.git",
        "git@github.com:owner/example-app.git"
      ],
      "baseBranch": "main"
    },
    {
      "name": "repo-flow",
      "localPath": "C:\\Projects\\RepoFlow\\repo-flow",
      "slug": "owner/repo-flow",
      "expectedOrigins": [
        "https://github.com/owner/repo-flow.git",
        "git@github.com:owner/repo-flow.git"
      ],
      "baseBranch": "main"
    }
  ],
  "issues": {
    "manifestPath": "./issues-manifest.json"
  },
  "git": {
    "requireCleanWorkingTree": true,
    "deleteMergedLocalBranches": true,
    "pruneRemoteReferences": true,
    "signOffCommits": false,
    "preCommitFixAttempts": 1
  },
  "agent": {
    "provider": "claude",
    "command": "claude",
    "model": "claude-sonnet-4-6",
    "minimumCliVersion": null,
    "heartbeatSeconds": 15,
    "reasoningEffort": "low",
    "ciFixReasoningEffort": "low",
    "preCommitFixReasoningEffort": "low",
    "runProjectChecks": false
  },
  "pullRequest": {
    "createDraft": true,
    "templatePath": "./.github/pull_request_template.md",
    "mergeMethod": "squash",
    "deleteBranchOnMerge": true
  },
  "messages": {
    "initialCommit": "{verb} #{issueNumber}: {issueTitle}",
    "reviewCommit": "Fix review feedback for #{issueNumber}",
    "ciFixCommit": "Fix CI for #{issueNumber}",
    "pullRequestTitle": "{verb} #{issueNumber}: {issueTitle}"
  },
  "ci": {
    "mode": "require-passing",
    "pollSeconds": 30,
    "timeoutSeconds": 1800,
    "autoFixAttempts": 1
  },
  "reviewFeedback": {
    "enabled": true,
    "confirmBeforeRun": true,
    "trustedAssociations": [
      "OWNER",
      "MEMBER",
      "COLLABORATOR"
    ]
  }
}
